,Place of interest,Place address,Station name,Station address,Recorrido
0,Jardines Gregorio Ordóñez,CALLE PRINCIPE DE VERGARA 68,143 - Diego de León 52,Calle Diego de León nº 52,126.92
1,Jardines San Francisco el Grande,AVENIDA GRAN VIA DE SAN FRANCISCO 25,37 - Plaza de San Francisco,Plaza de San Francisco nº 5,93.08
2,Jardines de Andrés Saborit,CALLE RAIMUNDO FERNANDEZ VILLAVERDE 32,133 - Raimundo Fernández,Calle Raimundo Fernández Villaverde nº 33,173.25
3,Jardines de El Buen Retiro,PLAZA INDEPENDENCIA 7,60 - Plaza de la Independencia,Plaza de la Independencia nº 6,53.25
4,Jardines de Gloria Fuertes,CALLE MADRE DE DIOS 2,254 - Pío XII,Avenida Pío XII nº 3,255.11
5,Jardines de José Luis Jiménez Manso,CALLE CAMINO DE LOS VINATEROS 1,218 - Camino Vinateros,Calle Camino de los Vinateros nº 28,305.99
6,Jardines de Perón,AVENIDA GENERAL PERON 21,154 - Orense 36,Calle Orense nº 36,283.87
7,Jardines de Sabatini,CALLE BAILEN 2,30 - San Quintín,Calle Pavía nº 6,203.18
8,Jardines de San Fernando,AVENIDA ALBERTO ALCOCER 9,157 - Castellana 164,Paseo de la Castellana nº 164,241.27
9,Jardines de la Avenida de Brasil,AVENIDA BRASIL 31,156 - Sor Ángela de la Cruz,Calle Sor Ángela de la Cruz nº 2,223.13
10,Jardines de la Basílica,CALLE BASILICA 15,151 - Orense 12,Calle Orense nº 12,38.49
11,Jardines de la Plaza Conde del Valle de Suchil,CALLE RODRIGUEZ SAN PEDRO 3 B,3 - Plaza Conde Suchil,Plaza del Conde del Valle de Súchil nº 3,130.46
12,Jardines de la Plaza de Chamberí,PLAZA CHAMBERI 1,124 - Manuel Silvela,Calle Manuel Silvela nº 20,288.05
13,Jardines de la Plaza de Olavide,PLAZA OLAVIDE 16,124 - Manuel Silvela,Calle Manuel Silvela nº 20,233.34
14,"Jardines de la Plaza de Oriente, Lepanto y Cabo Noval",CALLE BAILEN 17,30 - San Quintín,Calle Pavía nº 6,176.7
15,Jardines de la Plaza de la Villa de París,CALLE GENERAL CASTAÑOS 6,10 - Marqués de la Ensenada,Calle Marqués de la Ensenada nº 16,175.18
16,Jardines de la Vega,CUESTA VEGA 1,166 - Segovia 26,Calle Segovia nº 26,231.61
17,Jardines de la calle Teresita González Quevedo,PLAZA SAN AMARO 4,154 - Orense 36,Calle Orense nº 36,280.75
18,Jardines de las Vistillas,CALLE MORERIA 12,166 - Segovia 26,Calle Segovia nº 26,142.75
19,Jardines del Arquitecto Ribera,CALLE BARCELO 2,54 - Barceló,Calle Barceló nº 7,33.97
20,Jardines del Descubrimiento,CALLE GOYA 2,93 - Plaza de Colón,Calle Goya nº 1,87.57
21,Jardines del Doctor Fleming,CALLE DOCTOR FLEMING 1,253 - Doctor Fleming,Calle Doctor Fleming nº 7,146.91
22,Jardines del Mundial. Castellana,PASEO CASTELLANA 142 B,253 - Doctor Fleming,Calle Doctor Fleming nº 7,283.86
23,Jardines del Príncipe de Anglona,PLAZA PAJA 6,35 - Plaza del Cordón,Plaza del Cordón,153.55
24,Jardín Botánico de Pradolongo,AVENIDA RAFAELA YBARRA,213 - Glorieta de Cádiz,Calle Antonio López nº 129,2158.59
25,Jardín Concejal Alejandro Muñoz Revenga,CALLE MELENDEZ VALDES 32,123 - Guzmán el Bueno,Calle Guzmán el Bueno nº 1,294.39
26,Jardín Doña Concha Piquer,PASEO IMPERIAL 93,169 - Pirámides,Calle Toledo nº 181,139.51
27,Jardín Fachada Pirámides I,PASEO ACACIAS 60,169 - Pirámides,Calle Toledo nº 181,76.34
28,Jardín Glorieta de Azorín,CUESTA VEGA 3,167 - Segovia 45,Calle Segovia nº 45,185.63
29,Jardín Jazmín,CALLE ROQUETAS DE MAR 10,249 - Manuel Caldeiro,Paseo de la Castellana nº 298,2826.15
30,Jardín Palacio O'Reilly,PLAZA CRUZ VERDE 2,35 - Plaza del Cordón,Plaza del Cordón,167.32
31,Jardín de Embajadores M-30,CALLE PUERTO DE LA CRUZ VERDE 29,235 - Embajadores 191,Calle Sodio nº 1B,758.74
32,Jardín de Larra,CALLE FACTOR 7,36 - Plaza Ramales,Plaza de Ramales,120.1
33,Jardín de la Colonia Congosto,CALLE CONGOSTO 70,221 - Pavones,Calle Hacienda de Pavones nº 342,3746.44
34,Jardín de las Bellas Artes,PASEO CASTELLANA 78 B,139 - José Gutiérrez Abascal ,Calle José Gutiérrez Abascal nº 2,79.46
35,Jardín del Bulevar de Peña Gorbea,CALLE PEÑA GORBEA 17 B,227 - Concordia,Calle Arroyo del Olivar nº 6,249.4
36,Jardín del Maestro Padilla,CALLE SAN ALEJANDRO 1,223 - Ermita Santo,Paseo de la Ermita del Santo nº 48,438.62
37,Jardín del Templo de Debod,CALLE FERRAZ 1,115 - Ferraz,Calle Evaristo San Miguel nº 2,139.56
38,Jardín del paseo Federico García Lorca,PASEO FEDERICO GARCIA LORCA 21,221 - Pavones,Calle Hacienda de Pavones nº 342,2992.05
39,Jardín el Torero,CALLE TORERO 6,222 - Antonio López,Calle Eugenio Caxes frente al nº 12,332.64
40,Jardín histórico El Capricho de la Alameda Osuna,PASEO ALAMEDA DE OSUNA 25,215 - Gutierre de Cetina,Calle Gutierre de Cetina nº 77,5329.69
41,Palacio de Cristal de la Arganzuela: Invernadero,PASEO CHOPERA 10,165 - Entrada Matadero,Paseo de la Chopera nº 14,124.44
42,Parque Agustín Rodríguez Sahagún,PASEO DIRECCION 301,207 - Remonta,Calle Azucenas nº 1,1084.41
43,Parque Alcalde Jesús Pérez Quijano,CALLE LADERA DE LOS ALMENDROS,221 - Pavones,Calle Hacienda de Pavones nº 342,1371.14
44,Parque Alfredo Kraus,CALLE MAR ADRIATICO 5,230 - Carlota O’Neill,Calle Carlota O'Neill nº 32,3221.05
45,Parque Almansa,CALLE ALMANSA 97,256 - Reina Victoria,Calle Beatriz de Bobadilla frente al nº 2,327.68
46,Parque Aluche,CALLE TEMBLEQUE 45,224 - Caramuel,Calle Caramuel nº 51,3806.06
47,Parque Aluche - Poblados,CALLE GUAREÑA 22,224 - Caramuel,Calle Caramuel nº 51,4866.63
48,Parque Alzola,CALLE BEASAIN 2,213 - Glorieta de Cádiz,Calle Antonio López nº 129,2853.99
49,Parque Antonio Pirala,CALLE ANTONIO PIRALA 8,188 - Puente de Ventas,Avenida de Daroca nº 2,290.6
50,Parque Anunciación,CALLE ANUNCIACION 1,74 - Puerta del Pacífico ,Avenida de Menéndez Pelayo nº 73,96.37
51,Parque Arquitecto Antonio Palacios,CALLE FENELON 17,215 - Gutierre de Cetina,Calle Gutierre de Cetina nº 77,3726.61
52,Parque Arroyo Fontarrón,CALLE ARROYO FONTARRON 22,221 - Pavones,Calle Hacienda de Pavones nº 342,647.97
53,Parque Arroyo Fresno,AVENIDA VENTISQUERO DE LA CONDESA 43,217 - Pedro Rico,Calle Pedro Rico nº 4,3432.31
54,Parque Arroyo Pozuelo,Calle Arroyo Pozuelo ,261 - Facultad Derecho,Avenida Complutense nº 23,6287.01
55,Parque Arroyo de los Pinos,CALLE JOAQUIN LORENZO 21,261 - Facultad Derecho,Avenida Complutense nº 23,2553.89
56,Parque Avenida de Portugal,AUTOVIA A-5 300,216 - Puerta del Ángel,Plaza Puerta del Ángel nº 4,838.77
57,Parque Azorín,AVENIDA ALBUFERA 142,226 - Sierra Toledana,Camino de Valderribas nº 94,1092.76
58,Parque Barrio Las Musas,AVENIDA NIZA 55 B,215 - Gutierre de Cetina,Calle Gutierre de Cetina nº 77,3728.57
59,Parque Begoña,CALLE SAN MODESTO 1,217 - Pedro Rico,Calle Pedro Rico nº 4,343.17
60,Parque Biosaludable,PASEO ALAMEDA DE OSUNA 8,215 - Gutierre de Cetina,Calle Gutierre de Cetina nº 77,4852.16
61,Parque Campo de la Paloma,AVENIDA RAFAEL ALBERTI 38,221 - Pavones,Calle Hacienda de Pavones nº 342,2148.39
62,Parque Caramuel,CALLE CARAMUEL 53,224 - Caramuel,Calle Caramuel nº 51,144.27
63,Parque Cerro Almodóvar,CALLE MARCELINO CASTILLO 29,224 - Caramuel,Calle Caramuel nº 51,2474.63
64,Parque Cerro Peñabel,CALLE CANDIDO MATEOS 12,239 - Francos Rodríguez,Calle Francos Rodríguez nº 62,2238.19
65,Parque Cerro del Tío Pío,CALLE BENJAMIN PALENCIA 2,226 - Sierra Toledana,Camino de Valderribas nº 94,656.37
66,Parque Cerro Águila,CAMINO CERRO DEL AGUILA 1,261 - Facultad Derecho,Avenida Complutense nº 23,3614.19
67,Parque Ciudad de los Ángeles,CALLE ANOETA 14 B,213 - Glorieta de Cádiz,Calle Antonio López nº 129,4040.7
68,Parque Cuesta del Galbán,CUESTA GALBAN 2,261 - Facultad Derecho,Avenida Complutense nº 23,4318.51
69,Parque Cuña Verde de Vicálvaro. Zona A,AVENIDA DAROCA 300,221 - Pavones,Calle Hacienda de Pavones nº 342,2119.02
70,Parque Cuña Verde de Vicálvaro. Zona B,AVENIDA DAROCA 299,221 - Pavones,Calle Hacienda de Pavones nº 342,2210.36
71,Parque Cuña Verde de Vicálvaro. Zona C,AVENIDA CANILLEJAS A VICALVARO 102,221 - Pavones,Calle Hacienda de Pavones nº 342,3213.22
72,Parque Dehesa de la Villa,CARRETERA DEHESA DE LA VILLA 1,261 - Facultad Derecho,Avenida Complutense nº 23,1246.15
73,Parque Duque de Ahumada,CALLE LAGO VAN 16,221 - Pavones,Calle Hacienda de Pavones nº 342,3201.87
74,Parque El Calero,CALLE JOSE DEL HIERRO 1,189 - Avenida Donostiarra,Calle Virgen de la Alegría nº 18,399.56
75,Parque El Cedral,CALLE ARTURO SORIA 233,254 - Pío XII,Avenida Pío XII nº 3,1374.89
76,Parque El Cruce,CALLE ALCOCER 1,213 - Glorieta de Cádiz,Calle Antonio López nº 129,4275.1
77,Parque Emir Mohamed I,CUESTA RAMON 1,166 - Segovia 26,Calle Segovia nº 26,147.98
78,Parque Emperatriz María de Austria,CALLE VIA LUSITANA 3,212 - Marqués de Vadillo,Glorieta Marqués de Vadillo nº 9,1902.59
79,Parque Enrique Tierno Galván,CALLE MENESES 4,180 - Méndez Álvaro,Calle Retama nº 5,678.41
80,Parque Entrevías Forestal,CALLE EMBAJADORES 251,227 - Concordia,Calle Arroyo del Olivar nº 6,2897.24
81,Parque Entrevías Urbano,RONDA SUR 8,227 - Concordia,Calle Arroyo del Olivar nº 6,2409.05
82,Parque Este de Valdebernardo,AVENIDA DEMOCRACIA 25,221 - Pavones,Calle Hacienda de Pavones nº 342,1965.5
83,Parque Eugenia de Montijo,CALLE PARQUE EUGENIA DE MONTIJO 3,224 - Caramuel,Calle Caramuel nº 51,4268.11
84,Parque Eva Duarte,CALLE DOCTOR GOMEZ ULLA 9,145 - Ortega y Gasset 87,Calle Ortega y Gasset nº 87,362.64
85,Parque Forestal Fuente Carrantona,CALLE FUENTE CARRANTONA 38,221 - Pavones,Calle Hacienda de Pavones nº 342,1210.38
86,Parque Forestal Julio Alguacil Gómez,PARQUE Ctra Carabanchel a Villaverde  con vuelta Calle Verde Viento ,213 - Glorieta de Cádiz,Calle Antonio López nº 129,3700.96
87,Parque Forestal de Valdebebas-Felipe VI,AVENIDA LAS FUERZAS ARMADAS 11,230 - Carlota O’Neill,Calle Carlota O'Neill nº 32,4666.41
88,Parque Forestal de Vicálvaro,PASEO POLIDEPORTIVO 1,221 - Pavones,Calle Hacienda de Pavones nº 342,3343.88
89,Parque Félix Rodríguez de la Fuente,CALLE PADRE CLARET 38,251 - Corazón de María,Calle Santa Hortensia nº 31,888.48
90,Parque General Fanjul - Santa Margarita,AVENIDA DE LAS ÁGUILAS 144,224 - Caramuel,Calle Caramuel nº 51,6919.23
91,Parque Hortaleza,CARRETERA ESTACION DE HORTALEZA 18,254 - Pío XII,Avenida Pío XII nº 3,3672.55
92,Parque Huerta del Obispo.,CALLE PALOMARES 34,213 - Glorieta de Cádiz,Calle Antonio López nº 129,4859.31
93,Parque Juan Carlos I,"GLORIETA S.A.R. DON JUAN DE BORBON Y BATTEMBERG, 5 5",230 - Carlota O’Neill,Calle Carlota O'Neill nº 32,4210.87
94,Parque Juan Pablo II,AVENIDA MACHUPICHU 1,230 - Carlota O’Neill,Calle Carlota O'Neill nº 32,3122.15
95,Parque Juan de la Cosa,CALLE VICTOR ANDRES BELAUNDE 1,197 - Parque Berlín,Avenida de Concha Espina nº 34,321.1
96,Parque La Rinconada,CALLE HIENDELAENCINA 9,261 - Facultad Derecho,Avenida Complutense nº 23,4198.41
97,Parque La Viña,CALLE TIMOTEO PEREZ RUBIO 9,180 - Méndez Álvaro,Calle Retama nº 5,970.26
98,Parque Ladera de los Almendros,CALLE LADERA DE LOS ALMENDROS 46,221 - Pavones,Calle Hacienda de Pavones nº 342,1055.36
99,Parque Lineal de Palomeras,AVENIDA ALBUFERA 293,221 - Pavones,Calle Hacienda de Pavones nº 342,1631.68
100,Parque Lineal del Manzanares (Usera - Pte de Vallecas),CAMINO PERALES 47,235 - Embajadores 191,Calle Sodio nº 1B,1059.64
101,Parque Madrid Río,PASARELA HISTORICA PASEO DE LAS YESERIAS ,169 - Pirámides,Calle Toledo nº 181,410.03
102,Parque Martala,AVENIDA MORATALAZ 183,219 - Marroquina,Calle Camino de los Vinateros nº 108,318.27
103,Parque Martin Luther King,CALLE CERRO NEGRO 1,179 - Puente de Vallecas,Avenida de la Albufera nº 6,101.71
104,Parque Meseta de Orcasitas,RONDA COOPERATIVAS 6,213 - Glorieta de Cádiz,Calle Antonio López nº 129,2545.53
105,Parque Mirador de Tierno Galván,CALLE NEBULOSAS 7,118 - Juan Martín,Calle Juan Martín el Empecinado nº 16,733.3
106,Parque Mirador de las Cárcavas,CALLE RAFAELA APARICIO 2,230 - Carlota O’Neill,Calle Carlota O'Neill nº 32,4331.27
107,Parque Norte,CALLE ARZOBISPO MORCILLO 7,217 - Pedro Rico,Calle Pedro Rico nº 4,545.2
108,Parque Nudo Norte de Begoña,AVENIDA LLANO CASTELLANO 1,249 - Manuel Caldeiro,Paseo de la Castellana nº 298,511.5
109,Parque Olof Palme,CALLE CERECINOS 1,228 - San Delfín,Calle San Delfín nº 9,1241.31
110,Parque Orlando Zapata Tamayo,CALLE URUGUAY 6,160 - Colombia,Calle Colombia nº 7,336.96
111,Parque Paseo Muñoz Grandes,PASEO MARCELINO CAMACHO 6,224 - Caramuel,Calle Caramuel nº 51,2959.15
112,Parque Payaso Fofó,CALLE PAYASO FOFO 11,227 - Concordia,Calle Arroyo del Olivar nº 6,854.86
113,Parque Peñuelas,CALLE GARGANTILLA 2,173 - Puente Praga,Paseo de la Esperanza nº 59,194.22
114,Parque Pinar de la Elipa,CALLE FELIX RODRIGUEZ DE LA FUENTE 26,233 - Marqués de Corbera 12,Avenida Marqués de Corbera nº 12,470.96
115,Parque Pinar del Rey,CARRETERA CANILLAS 1,214 - Condesa de Venadito,Calle Condesa de Venadito nº 2,2267.32
116,Parque Plaza Chozas de Canales,CARRETERA VILLAVERDE A VALLECAS 10,235 - Embajadores 191,Calle Sodio nº 1B,4061.07
117,Parque Plaza Colonia Oroquieta,CARRETERA VILLAVERDE A VALLECAS 1 B,235 - Embajadores 191,Calle Sodio nº 1B,4106.99
118,Parque Plaza de España,PLAZA ESPAÑA 20,116b - Plaza de España B,Calle Princesa nº 5,125.11
119,Parque Quinta de los Molinos,CALLE ALCALA 527,215 - Gutierre de Cetina,Calle Gutierre de Cetina nº 77,2577.2
120,Parque Ramírez de Prado,CALLE RAMIREZ DE PRADO 2,118 - Juan Martín,Calle Juan Martín el Empecinado nº 16,213.28
121,Parque Roma,CALLE JUAN ESPLANDIU 4,182 - Parque Roma,Calle Alcalde Sáinz de Baranda frente al nº 107,433.87
122,Parque Salvador de Madariaga,CALLE SALVADOR DE MADARIAGA 9,231 - Derechos Humanos,Calle Derechos Humanos nº 12,157.13
123,Parque San Blas. El Paraíso,AVENIDA ARCENTALES 4,215 - Gutierre de Cetina,Calle Gutierre de Cetina nº 77,2098.34
124,Parque San José de Calasanz,CALLE JOAQUIN MARIA LOPEZ 39,128 - Cea Bermúdez,Calle Cea Bermúdez nº 59,180.27
125,Parque San Juan Bautista,CALLE AGASTIA 87,214 - Condesa de Venadito,Calle Condesa de Venadito nº 2,923.33
126,Parque Sancho Dávila,PLAZA AMERICA ESPAÑOLA 4,187 - Alcalá-Ventas,Calle Alejandro González nº 1,246.83
127,Parque Santa Eugenia,CALLE Cerro Almodóvar 1,221 - Pavones,Calle Hacienda de Pavones nº 342,3604.68
128,Parque Santa Rita,CALLE ALBA DE TORMES 2,212 - Marqués de Vadillo,Glorieta Marqués de Vadillo nº 9,3619.48
129,Parque Segura,CALLE SEGURA 5,213 - Glorieta de Cádiz,Calle Antonio López nº 129,2916.0
130,Parque Soto de Entrevías,CARRETERA ACCESO A LA ESTACION DE AUTOBUSES DE LA E.M.T. 9,180 - Méndez Álvaro,Calle Retama nº 5,1958.76
131,Parque Urpisa,CAMINO VASARES 2,221 - Pavones,Calle Hacienda de Pavones nº 342,2561.99
132,Parque Valdebernardo Este,CALLE CORDEL DE PAVONES 2,221 - Pavones,Calle Hacienda de Pavones nº 342,1898.11
133,Parque Valle de Enmedio,CALLE MIRADOR DE LA REINA 22,239 - Francos Rodríguez,Calle Francos Rodríguez nº 62,4021.23
134,Parque Vallecas Villa,CALLE BABILAFUENTE 2,221 - Pavones,Calle Hacienda de Pavones nº 342,3359.44
135,Parque Vandel,CALLE MOLINA DE SEGURA 10,221 - Pavones,Calle Hacienda de Pavones nº 342,570.95
136,Parque Virgen de la Esperanza,CALLE ANOETA 45,213 - Glorieta de Cádiz,Calle Antonio López nº 129,4222.23
137,Parque de Alfonso XIII,AVENIDA ALFONSO XIII 136,160 - Colombia,Calle Colombia nº 7,856.02
138,Parque de Amos Acero,CALLE SIERRA MOLINA 1,227 - Concordia,Calle Arroyo del Olivar nº 6,537.73
139,Parque de Ana Tutor,CALLE VALLE DE PINARES LLANOS 1,217 - Pedro Rico,Calle Pedro Rico nº 4,3267.7
140,Parque de Arriaga,AVENIDA DAROCA 95,215 - Gutierre de Cetina,Calle Gutierre de Cetina nº 77,548.77
141,Parque de Atenas,CALLE SEGOVIA 28,166 - Segovia 26,Calle Segovia nº 26,174.12
142,Parque de Berlín,AVENIDA RAMON Y CAJAL 2,197 - Parque Berlín,Avenida de Concha Espina nº 34,222.27
143,Parque de Breogán,AVENIDA BRASILIA 2,240 - Avenida Brasilia,Avenida de Brasilia frente al nº 9,53.96
144,Parque de Canillejas,CALLE CIRCE 57,215 - Gutierre de Cetina,Calle Gutierre de Cetina nº 77,3628.28
145,Parque de Comillas,CALLE MIGUEL SORIANO 1,228 - San Delfín,Calle San Delfín nº 9,735.63
146,Parque de Darwin,CALLE MANUEL MARIA ARRILLAGA 29 B,225 - Doctor Lozano,Calle Sierra Toledana nº 33,495.16
147,Parque de Enrique Herreros,CALLE BRAVO MURILLO 49,201 - Canal,Calle José Abascal frente al nº 2,95.59
148,Parque de Francos Rodríguez,AVENIDA DOCTOR FEDERICO RUBIO Y GALI 63,237 - Pablo Iglesias,Calle Francisco Balseiro nº 1,488.05
149,Parque de Fuencarral,CALLE NUESTRA SEÑORA DE VALVERDE 151,217 - Pedro Rico,Calle Pedro Rico nº 4,2145.79
150,Parque de Fuentechica,CALLE ANASTASIA LOPEZ 21,217 - Pedro Rico,Calle Pedro Rico nº 4,1664.41
151,Parque de Fuentelarreina,CALLE ROSALIA DE CASTRO 80,261 - Facultad Derecho,Avenida Complutense nº 23,3637.51
152,Parque de Gabriela Mistral,CALLE ROSALIA DE CASTRO 69,261 - Facultad Derecho,Avenida Complutense nº 23,3746.52
153,Parque de Isabel Clara Eugenia,CALLE MAR CASPIO 4,230 - Carlota O’Neill,Calle Carlota O'Neill nº 32,3344.04
154,Parque de Juan XXIII,PASEO JUAN XXIII 21,237 - Pablo Iglesias,Calle Francisco Balseiro nº 1,360.24
155,Parque de Las Cruces,AVENIDA POBLADOS 74,224 - Caramuel,Calle Caramuel nº 51,4581.96
156,Parque de Malmoe,CALLE MALMOE 2,221 - Pavones,Calle Hacienda de Pavones nº 342,1944.21
157,Parque de Manoteras,CALLE BACARES 22,254 - Pío XII,Avenida Pío XII nº 3,2435.81
158,Parque de Pan Bendito,AVENIDA POBLADOS 35,224 - Caramuel,Calle Caramuel nº 51,4855.18
159,Parque de Peñagrande,CALLE LEOPOLDO ALAS CLARIN 53 c/v C/ Doctor Reinosa,261 - Facultad Derecho,Avenida Complutense nº 23,3445.67
160,Parque de Pinar de Barajas,AUTOVIA A-2 700,230 - Carlota O’Neill,Calle Carlota O'Neill nº 32,2040.3
161,Parque de Plata y Castañar,GLORIETA MIRADOR DEL SUR 1,213 - Glorieta de Cádiz,Calle Antonio López nº 129,4780.84
162,Parque de Pradolongo,AVENIDA RAFAELA YBARRA 85,213 - Glorieta de Cádiz,Calle Antonio López nº 129,1986.78
163,Parque de Rafael Finat,CALLE VIDAUBA 4,224 - Caramuel,Calle Caramuel nº 51,4881.36
164,Parque de Salvador Allende,CALLE SALVADOR ALLENDE 3,212 - Marqués de Vadillo,Glorieta Marqués de Vadillo nº 9,5913.82
165,Parque de San Isidro,PASEO ERMITA DEL SANTO 74 c/v Pso. Quince de Mayo,223 - Ermita Santo,Paseo de la Ermita del Santo nº 48,955.95
166,Parque de Santa Ana,CALLE SAN CUGAT DEL VALLES 4,217 - Pedro Rico,Calle Pedro Rico nº 4,1902.4
167,Parque de Villa Rosa-Paco Caño,CALLE ACONCAGUA 2,230 - Carlota O’Neill,Calle Carlota O'Neill nº 32,3388.16
168,Parque de la Alcazaba,CALLE RIBADAVIA 45,207 - Remonta,Calle Azucenas nº 1,1531.37
169,Parque de la Almudena,CALLE NICOLAS SALMERON 4,215 - Gutierre de Cetina,Calle Gutierre de Cetina nº 77,1392.82
170,Parque de la Amistad,CALLE SANTA PETRONILA 21,235 - Embajadores 191,Calle Sodio nº 1B,4560.99
171,Parque de la Bombilla,AVENIDA VALLADOLID 4,112 - Paseo de Moret,Paseo de Moret nº 11,673.21
172,Parque de la Casa de Campo,PASEO PUERTA DEL ANGEL 1,216 - Puerta del Ángel,Plaza Puerta del Ángel nº 4,234.17
173,Parque de la Cuña Verde de Latina,CALLE CONCEJAL FRANCISCO JOSE JIMENEZ MARTIN 11,224 - Caramuel,Calle Caramuel nº 51,2465.26
174,Parque de la Cuña Verde de O´Donnell,CALLE FUENTE CARRANTONA 61,221 - Pavones,Calle Hacienda de Pavones nº 342,1457.97
175,Parque de la Dehesa Boyal,CALLE BURJASOT 1 A,235 - Embajadores 191,Calle Sodio nº 1B,4995.29
176,Parque de la Gavia,AVENIDA MAYORAZGO 26,221 - Pavones,Calle Hacienda de Pavones nº 342,3679.34
177,Parque de la Maceta,AVENIDA DAROCA 301,221 - Pavones,Calle Hacienda de Pavones nº 342,2294.71
178,Parque de la Montaña Templo de Debod,CALLE PROFESOR MARTIN ALMAGRO BASCH ,115 - Ferraz,Calle Evaristo San Miguel nº 2,259.79
179,Parque de la Supermanzana,CALLE SANGENJO 27,217 - Pedro Rico,Calle Pedro Rico nº 4,1442.35
180,Parque de la Ventilla,CALLE VIA LIMITE 51,248 - Torre Cepsa,Calle Sinesio Delgado nº 2,560.23
181,Parque de la Vicalvarada,CALLE VILLABLANCA 1,221 - Pavones,Calle Hacienda de Pavones nº 342,3063.97
182,Parque de la Volatería,AVENIDA POBLADOS 110,212 - Marqués de Vadillo,Glorieta Marqués de Vadillo nº 9,3288.72
183,Parque de las Avenidas,AVENIDA BRASILIA 6,242 - Avenida Bruselas,Avenida Bruselas nº 56,416.65
184,Parque de las Delicias,CALLE PARROCO EUSEBIO CUENCA 13,118 - Juan Martín,Calle Juan Martín el Empecinado nº 16,516.86
185,Parque de los Llanos,CALLE DIONISIO INCA YUPANQUI 8,230 - Carlota O’Neill,Calle Carlota O'Neill nº 32,3064.26
186,Parque de los Tilos,CALLE NICOLAS SALMERON 1,215 - Gutierre de Cetina,Calle Gutierre de Cetina nº 77,1082.93
187,Parque del Bronce,CALLE BRONCE 5,235 - Embajadores 191,Calle Sodio nº 1B,338.34
188,Parque del Espinillo,CALLE UNANIMIDAD 23,235 - Embajadores 191,Calle Sodio nº 1B,3174.39
189,Parque del Museo del Prado,PASEO PRADO 11,68 - Espalter,Calle Espalter nº 1,176.23
190,Parque del Oeste,PASEO CAMOENS Y VALERO 4,112 - Paseo de Moret,Paseo de Moret nº 11,401.66
191,Parque del Pueblo del Pardo,AVENIDA GUARDIA 4,261 - Facultad Derecho,Avenida Complutense nº 23,9100.69
192,Pinar Santa Eugenia,CALLE CERRO DE ALMODOVAR 1,221 - Pavones,Calle Hacienda de Pavones nº 342,3623.42
193,Plaza Mayor de Barajas,PLAZA MAYOR DE BARAJAS 1,215 - Gutierre de Cetina,Calle Gutierre de Cetina nº 77,8548.04
194,Plaza de Murillo,PLAZA MURILLO 1,68 - Espalter,Calle Espalter nº 1,89.85
195,Plaza de la Lealtad,JARDINES PLAZA DE LA LEALTAD ,86 - Cibeles,Plaza Cibeles,197.85
196,Quinta de Torre Arias,CALLE ALCALA 551,215 - Gutierre de Cetina,Calle Gutierre de Cetina nº 77,2958.77
197,Quinta de la Fuente del Berro,CALLE ENRIQUE D'ALMONTE 1,185 - Quinta Fuente del Berro,Calle Sancho Dávila esquina Paseo Marqués de Zafra,257.31
198,Rosaleda de Madrid. Parque del Oeste,CALLE ROSALEDA 1,113 - Pintor Rosales,Paseo del Pintor Rosales frente al nº 38,247.88
199,Vivero Estufas de El Retiro,"GLORIETA ANGEL CAIDO 4 Parque del Retiro. Entrada por C/ Alfonso XII, frente a la cuesta de Claudio Moyano",75 - Menéndez Pelayo,Avenida de Menéndez Pelayo con calle Poeta Esteban Villegas,465.4
200,Vivero de la Casa de Campo,PASEO AZUL 2,216 - Puerta del Ángel,Plaza Puerta del Ángel nº 4,677.87
201,Vivero municipal de Migas Calientes,AUTOVIA M-30 2200,257 - INEF,Avenida Juan de Herrera frente a la calle Paul Guinard,1323.79
202,Zona verde C/ Fresnedillas,CALLE FRESNEDILLAS 1 C/ Los Gavilanes y C/ Gabriela Mistral,261 - Facultad Derecho,Avenida Complutense nº 23,3286.68
203,Área Forestal de Tres Cantos,CARRETERA M-607 2100,217 - Pedro Rico,Calle Pedro Rico nº 4,11431.85
